{
  "slug": "daisuke-sekimoto",
  "name": "関本大介",
  "nameEn": "Daisuke Sekimoto",
  "aliases": [
    "Daisuke Sekimoto"
  ],
  "realName": null,
  "birthDate": null,
  "birthplace": null,
  "debutDate": null,
  "heightCm": null,
  "weightKg": null,
  "status": "unknown",
  "promotionSlugs": [],
  "finishingMoveSlugs": [],
  "sources": [
    {
      "url": "https://www.all-japan.co.jp/player/",
      "title": "所属選手・主な参戦選手 | 全日本プロレス",
      "retrievedAt": "2026-10-26"
    },
    {
      "url": "https://www.all-japan.co.jp/match/12639/",
      "title": "2026年10月3日 行田大会 試合結果 | 全日本プロレス",
      "retrievedAt": "2026-10-26"
    }
  ]
}
