{
  "slug": "saya-kamitani",
  "name": "上谷沙弥",
  "nameEn": "Saya Kamitani",
  "aliases": [
    "かみたにさや",
    "Saya Kamitani",
    "上谷 沙弥"
  ],
  "realName": null,
  "birthDate": null,
  "birthplace": null,
  "debutDate": null,
  "heightCm": null,
  "weightKg": null,
  "status": "active",
  "promotionSlugs": [
    "stardom"
  ],
  "finishingMoveSlugs": [],
  "sources": []
}
