{
  "slug": "yoh",
  "name": "YOH",
  "nameEn": "YOH",
  "aliases": [
    "ヨウ",
    "Yoh",
    "田中翔"
  ],
  "realName": null,
  "birthDate": "1988-06-25",
  "birthplace": "宮城県栗原市",
  "debutDate": "2012-11-19",
  "heightCm": 172,
  "weightKg": 85,
  "status": "active",
  "promotionSlugs": [
    "njpw"
  ],
  "finishingMoveSlugs": [
    "direct-drive"
  ],
  "sources": [
    {
      "url": "https://www.njpw.co.jp/profile/117051",
      "title": "YOH | 新日本プロレスリング株式会社",
      "retrievedAt": "2026-08-20"
    }
  ]
}
