{
  "slug": "ryuji-hijikata",
  "name": "土方隆司",
  "nameEn": "Hijikata Ryuji",
  "aliases": [
    "Hijikata Ryuji",
    "Ryuji Hijikata"
  ],
  "realName": null,
  "birthDate": null,
  "birthplace": null,
  "debutDate": null,
  "heightCm": null,
  "weightKg": null,
  "status": "active",
  "promotionSlugs": [],
  "finishingMoveSlugs": [],
  "sources": [
    {
      "url": "https://www.all-japan.co.jp/player/",
      "title": "所属選手・主な参戦選手 | 全日本プロレス",
      "retrievedAt": "2026-10-26"
    }
  ]
}
