{
  "slug": "jeff-cobb",
  "name": "ジェフ・コブ",
  "nameEn": "Jeff Cobb",
  "aliases": [
    "Jeff Cobb"
  ],
  "realName": null,
  "birthDate": null,
  "birthplace": null,
  "debutDate": null,
  "heightCm": null,
  "weightKg": null,
  "status": "unknown",
  "promotionSlugs": [],
  "finishingMoveSlugs": [],
  "sources": []
}
