{
  "slug": "hisaya-imabayashi",
  "name": "今林久弥",
  "nameEn": null,
  "aliases": [],
  "realName": null,
  "birthDate": null,
  "birthplace": null,
  "debutDate": null,
  "heightCm": null,
  "weightKg": null,
  "status": "unknown",
  "promotionSlugs": [],
  "finishingMoveSlugs": [],
  "sources": []
}
